[
  {
    "id": "al-hb-21-2024",
    "jurisdiction": "Alabama",
    "jurisdiction_code": "AL",
    "jurisdiction_type": "state",
    "record_type": "legislation",
    "title": "Alabama Genetic Data Privacy Act",
    "subtitle": "Privacy requirements for direct-to-consumer genetic testing companies",
    "identifier": "HB 21 (2024)",
    "bill_number": "HB 21",
    "session": "2024 Regular Session",
    "statute_citation": "Ala. Code §§ 8-43-1 to 8-43-6",
    "status": "enacted",
    "introduced_date": "2024-02-06",
    "signed_date": "2024-05-16",
    "effective_date": "2024-10-01",
    "last_action_date": "2024-05-16",
    "last_reviewed": "2026-09-02",
    "record_version": "1.1",
    "verification_status": "verified-primary",
    "topics": [
      "genetic-data-storage-privacy-sharing-industry"
    ],
    "summary": "Alabama's Genetic Data Privacy Act took effect on October 1, 2024. It regulates businesses that directly solicit biological samples from consumers for genetic-testing products or services, as well as contractors handling data for those businesses.",
    "legal_effects": "Genetic testing companies must publish privacy notices and obtain initial express consent. Separate consent is required for each transfer or disclosure, uses beyond the requested service, and marketing. The act also provides access, deletion, and sample-destruction procedures, requires security and contractor confidentiality, and authorizes Attorney General enforcement.",
    "plain_language": "If you use a consumer genetic testing service covered by the act, the company must explain its data practices and ask before several uses or disclosures. You may access your genetic data, withdraw consent, and request data deletion or sample destruction through the act's procedures.",
    "limitations": "The act does not cover every holder of genetic information. Its exclusions include HIPAA-covered entities and business associates, health care providers, and certain noncommercial research conducted by higher education institutions.",
    "primary_sources": [
      {
        "title": "HB 21 enrolled act",
        "url": "https://alison.legislature.state.al.us/files/pdf/SearchableInstruments/2024RS/HB21-enr.pdf",
        "publisher": "Alabama Legislature",
        "accessed_date": "2026-09-02"
      },
      {
        "title": "Alabama Code § 8-43-2",
        "url": "https://alison.legislature.state.al.us/code-of-alabama?section=8-43-2",
        "publisher": "Alabama Legislature",
        "accessed_date": "2026-09-02"
      }
    ],
    "secondary_sources": [
      {
        "title": "Alabama HB 21 legislative history",
        "url": "https://legiscan.com/AL/bill/HB21/2024",
        "publisher": "LegiScan",
        "accessed_date": "2026-08-31"
      }
    ],
    "history": [
      {
        "date": "2024-02-06",
        "event": "Bill introduced and referred to the House Judiciary Committee.",
        "source": "Alabama Legislature"
      },
      {
        "date": "2024-02-20",
        "event": "House passed the bill.",
        "source": "Alabama Legislature"
      },
      {
        "date": "2024-05-08",
        "event": "Senate passed the bill as amended.",
        "source": "Alabama Legislature"
      },
      {
        "date": "2024-05-16",
        "event": "Enacted as Act 2024-384.",
        "source": "Alabama Legislature"
      },
      {
        "date": "2024-10-01",
        "event": "Act became effective.",
        "source": "Alabama Legislature"
      },
      {
        "date": "2026-08-31",
        "event": "Record created from the enrolled act, current code, and legislative history."
      },
      {
        "date": "2026-09-02",
        "event": "Project-authored analysis revised after primary-source review."
      }
    ]
  },
  {
    "id": "al-hb-263-2026",
    "jurisdiction": "Alabama",
    "jurisdiction_code": "AL",
    "jurisdiction_type": "state",
    "record_type": "legislation",
    "title": "Biological and neural data in health and fitness apps",
    "subtitle": "Proposed consent requirements for app-based data practices",
    "identifier": "HB 263 (2026)",
    "bill_number": "HB 263",
    "session": "2026 Regular Session",
    "status": "died",
    "introduced_date": "2026-01-15",
    "last_action_date": "2026-03-11",
    "last_reviewed": "2026-09-02",
    "record_version": "1.1",
    "verification_status": "verified-primary",
    "topics": [
      "genetic-data-storage-privacy-sharing-industry"
    ],
    "summary": "Alabama HB 263 did not become law. It would have regulated health and fitness applications that collect biological or neural data, including information generated by analyzing genetic or other biological properties to identify a person.",
    "legal_effects": "Covered app providers would have needed express consent before transferring or disclosing covered data, using it beyond a requested service, or using it for marketing. The Attorney General would have had exclusive enforcement authority, with a 45-day opportunity to cure and civil penalties of up to $3,000 per violation.",
    "plain_language": "The proposal would have let consumers limit how a covered health or fitness app reused or shared biological and neural data. Because the bill died, it created no new consent rights or penalties.",
    "limitations": "The proposal applied only to apps and data practices meeting its definitions. It excluded several categories, including certain regulated health information, research, insurance activities, deidentified data, security practices, and processing needed to provide a consumer-requested product or service.",
    "primary_sources": [
      {
        "title": "HB 263 engrossed bill",
        "url": "https://alison.legislature.state.al.us/files/pdf/SearchableInstruments/2026RS/HB263-eng.pdf",
        "publisher": "Alabama Legislature",
        "accessed_date": "2026-09-02"
      }
    ],
    "secondary_sources": [
      {
        "title": "Alabama HB 263 legislative history",
        "url": "https://legiscan.com/AL/bill/HB263/2026",
        "publisher": "LegiScan",
        "accessed_date": "2026-08-31"
      }
    ],
    "related_records": [
      {
        "record_id": "al-hb-436-2025",
        "relationship": "Successor to the broader 2025 proposal"
      }
    ],
    "history": [
      {
        "date": "2026-01-15",
        "event": "Bill introduced and referred to the House Judiciary Committee.",
        "source": "Alabama Legislature"
      },
      {
        "date": "2026-02-26",
        "event": "House passed the bill as amended.",
        "source": "Alabama Legislature"
      },
      {
        "date": "2026-03-11",
        "event": "Senate committee reported the bill and placed it on the calendar.",
        "source": "Alabama Legislature"
      },
      {
        "date": "2026-04-09",
        "event": "Bill died when the 2026 regular session adjourned without final passage.",
        "source": "Alabama Legislature"
      },
      {
        "date": "2026-08-31",
        "event": "Record created from the engrossed bill and legislative history."
      },
      {
        "date": "2026-09-02",
        "event": "Project-authored analysis revised after primary-source review."
      }
    ]
  },
  {
    "id": "al-hb-265-2026",
    "jurisdiction": "Alabama",
    "jurisdiction_code": "AL",
    "jurisdiction_type": "state",
    "record_type": "legislation",
    "title": "Unlawful use of DNA",
    "subtitle": "Renewed proposal for criminal offenses involving nonconsensual DNA use",
    "identifier": "HB 265 (2026)",
    "bill_number": "HB 265",
    "session": "2026 Regular Session",
    "status": "died",
    "introduced_date": "2026-01-15",
    "last_action_date": "2026-02-05",
    "last_reviewed": "2026-09-02",
    "record_version": "1.1",
    "verification_status": "verified-primary",
    "topics": [
      "privacy"
    ],
    "summary": "Alabama HB 265 did not become law. It would have created first-, second-, and third-degree offenses for intentionally collecting, retaining, testing, disclosing, selling, or transferring another person's DNA sample or genetic data without express consent in specified circumstances.",
    "legal_effects": "The bill would have assigned different criminal penalties to unauthorized DNA sale or transfer, genetic testing or disclosure, and collection or retention. It would have used definitions from Alabama's Genetic Data Privacy Act.",
    "plain_language": "The proposal would have criminalized several intentional uses of another person's DNA without permission. Because it died, the proposed offenses and penalties never took effect.",
    "limitations": "Exceptions would have applied to specified legal process, law enforcement and forensic databases, and genetic testing companies complying with state law. The bill reached the House calendar but did not receive a House floor vote.",
    "primary_sources": [
      {
        "title": "HB 265 introduced bill",
        "url": "https://alison.legislature.state.al.us/files/pdf/SearchableInstruments/2026RS/HB265-int.pdf",
        "publisher": "Alabama Legislature",
        "accessed_date": "2026-09-02"
      }
    ],
    "secondary_sources": [
      {
        "title": "Alabama HB 265 legislative history",
        "url": "https://legiscan.com/AL/bill/HB265/2026",
        "publisher": "LegiScan",
        "accessed_date": "2026-08-31"
      }
    ],
    "related_records": [
      {
        "record_id": "al-hb-449-2025",
        "relationship": "Reintroduction of the 2025 proposal"
      }
    ],
    "history": [
      {
        "date": "2026-01-15",
        "event": "Bill introduced and referred to the House Judiciary Committee.",
        "source": "Alabama Legislature"
      },
      {
        "date": "2026-02-05",
        "event": "Bill read a second time and placed on the House calendar.",
        "source": "Alabama Legislature"
      },
      {
        "date": "2026-04-09",